Unnamed: 0,id,body,subreddit,removed,context
131,131,"There are people who object to quotas because they believe it fosters more inequality and doesn't fix the real underlying problems.

And then there people like you who object to quotas because they're actually just shitlords.",australia,True,"Given my experience on how women in power treat those under them, I'd prefer they weren't."
279,279,"One of the ways I've seen the 457 visa holders abused was through poor working conditions.  The employer constantly holds the visa over their head.

Complain or cause problems for your employer, your visa is cancelled and you're out of the country.

Salary was an issue in IT, but you're right... it wouldn't be much of an issue for most Cooks.",australia,False,[deleted]
637,637,"I'm sure Australians back them up, just not this worthless government.",australia,True,"You want to have your own foreign policy without consulting Australia and then expect Australia to unconditionally back you up.  

Next time your government should consider the consequences of voicing it's opinion on the world stage without the support of its closest ally. "
642,642,"Oy vey!

Good goy, multiculturalism is good and healthy for Australia. We need to get of racism and islamophobia

",australia,True,"We have never been the clever country. We have always been an anti-intellectual, tall-poppy-cutting, cultural cringeing nation where xenophobia and racism is hiding just beneath the surface."
776,776,"&gt;1 hour of work does not an employed person make.

This honestly doesn't make much difference, and Roy Morgan count someone working 1 hour a week as employed too.

The number of people working 1 hour in a given period isn't that big, and it also includes a lot of people who usually work more. Checking the most recent figures, about 700k reported working 1-9 hours in whatever week we're talking about, which is about the same as the number of people who have a job but worked *zero* hours due to leave or whatever.

Critically, all these people reporting that they have jobs but worked 0 hours or 1-9 hours would show up as employed in Roy Morgan's survey, too, since they, you know, *have jobs*.

The biggest differences between Roy Morgan and the international standard definition of unemployment used by ABS are twofold.

The first is the definition of what ""looking for work"" means. It is tighter in the UN/International Labour Organisation definition (which is used by the ABS like any equivalent national body, and has nothing to do with what the government wants since the ABS is an independent agency). Specifically, you have to be actively looking for work, and ready to start work immediately, in order to be counted as unemployed within the labour force.

Roy Morgan also uses the ""looking for work"" definition, but there's is a much simpler self-reported question and therefore they don't factor in whether someone is available to work or not. For example, someone who is at school or uni, and in practical terms couldn't start work, but said they were looking, would be counted as unemployed. The difference between asking ""do you want a job?"" and actually asking about job-seeking activities and availability is the main source of difference in levels.

The second reason for variation is the ABS makes seasonal and trend adjustments so that the movement in u/e rate from period to period is reflecting actual change in the strength of the economy. Seasonal adjustment accounts for the fact that less people work in certain months (for example the Christmas boom, and agricultural harvest season). You can see the regular [jaggedness in this graph](http://2.bp.blogspot.com/-XmbV2lJXNHA/UDgcpNF7DHI/AAAAAAAACYg/BfZopElTbfI/s1600/DEEWR-payments-Original-Count-Unemployed-line-from1950.png) where unemployment declines around November and goes back up around February.

If we're being cynical, not accounting for seasonality gives Roy Morgan reliable headlines every few months as their estimates diverge more sharply from the ABS.

The reason for the focus on immediate availability and accounting for seasonality is there's a strong policy interest (particularly for the Reserve Bank in setting monetary policy) in knowing very specifically what working capacity in the economy is like, and a great measure of that is how many people are immediately available to work at a given moment. The RBA want to know if a movement in the unemployment rate is due to mere seasonality or due to the economy speeding up or slowing down.

In either case, to get the full picture of people's labour activities including underemployment, you need other data, things like who would like more hours, the hours worked per worker, who is studying, who is injured or disabled, structural vs frictional reasons for unemployment, etc. Unemployment rate alone was never intended to be a measure of social wellbeing - there's plenty of circumstances where an increase in the unemployment rate is strictly a good thing (eg if it's caused by more people seeking work, that can reflect an uptick in confidence).",australia,False,"It's not meaningful in any context. 1 hour of work does not an employed person make. Unemployment figures use completely arbitrary measurements which were decided on decades ago when women were housewives and men stayed with their employer for 30 years.

The Roy Morgan numbers and ABS do not agree because ABS have had the rules changed multiple times to massage the numbers to look more favourable for the government."
1073,1073,Found the Western Sharia law enthusiast.,australia,True,With stories on trannies and other degeneracy paid by the federal givernment the ABC has been done and dusted for a while now. 
1186,1186,"Doesn't matter its like winning the lottery, easy come - easy go. Money is useless in a coffin there isn't much space to begin with.",australia,False,"The deeply ironic aspect of the reverse mortgage idea is that it only hurts working class families who just happened to live in areas that had rapid increases in home prices due to population growth. As such, it's going to hurt the wealth generation of working class families and not the wealthy like so many people want. "
1414,1414,If the cassowaries are a problem just run through the Gympie Gympie bushes and straight up a tree. Cassowaries are afraid of drop bears.,australia,False,"North Queensland - if the crocks and sharks don't get you the stingers and irukanji will... Providing the taipans, brown snakes and death adders let you near the water and the cassowaries are feeling generous."
1417,1417,And you believe that? ,australia,True,"She did not delete subpoenaed evidence, that claim is not true.  She gave instruction to delete it prior to the subpoena and there is no evidence that the deletion targeted material that was relevant to the investigation. "
1466,1466,Only if you are rich. The liberals hate plebeians. ,australia,False,"But we can hopefully get lower income tax rates now, which would help us all out. 

We should never advocate more government, its our money we piss down the drain when it is wasted."
1566,1566,Ignorant cunts like you are part of the problem.,australia,True,"God damn muzzies need to be deported, the lot of them. "
1799,1799,The Aboriginal and Torres straight Islander flags are official flags of the country you racist nitwit.,australia,True,"Good. The national flag is appropriate but others are not. 

No flag of another group or another country should be flown equal to the national flag on government buildings."
1901,1901,"I was referring to what happened in the Howard years under what most liberals refer to as the best years of government. We had a surplus and were selling the country short so it looked good on paper.
Then we go through a global financial crisis, not global except Australia financial crisis. 
They did what they thought would keep spending up and generate consumer confidence in a bad time. 
Seemed to work as we kept our triple A rating despite giving money away and investing in a scam. 

I feel I am justified when he spouts bullshit.
Call things historical facts when they aren't, use pro active language such as scam and implying we just gave away money for no reason deserve the retaliatory attitude I took. 
You should eat shit too.😊",australia,True,"'Labor should balance the books and not borrow.'

""So you're fine with selling off assets so Australia looks good on the books?""

I'm not exactly a Liberal supporter but even I know that wanting to 'balance the books' does not mean 'sell everything'."
1926,1926,He could probably pull that woman's arm out of its socket and make it look gentle.,australia,False,"The real story is that security guard's FUCKING BEAST MODE ARMS

http://www.abc.net.au/news/image/8079778-3x2-700x467.jpg"
2015,2015,China is anything but little.,australia,False,"Good.

Finally some has some balls to stand up to these little asian bullies"
2026,2026,Do you recon by days as 365 in a year or are you saying year to date ( not year to**day** ) ?,australia,False,"No, we lost him 10 years ago yesterday."
2055,2055,"&gt; convenient terror raids

Oooh that's right. Islamic terrorism isn't real, its just an invented boogeyman wheeled out to frighten dumb sheeple into obeying.

Silly me. /s",australia,False,"But they don't do that, the AFP certainly appears to be the most political police force in Australia, what with the convenient terror raids, not investigating multiple breaches by a particular party but going after people that the same party they often ignore illegal behavior from want them to go after.

They are a farce, I don't know if they used to be back in the 90's or not, but if they weren't, then sometime during the Howard years they became political."
2058,2058,1080 founders edition will cost around 1200 in Australia 700 in America and the 1070 is 350 in America iirc. Wait for the 1070 the performance boost over the 970 will be worth the 100-200 price jump ,australia,False,"We've got a NAS in place to deal with archive stuff. Its running about 6TB of storage to deal with it all. Plus, we transcode a lot of stuff and use the NAS as a proxy as well to make things easier on the timeline.

I laughed when I saw the R5, thats the exact one we're going for and its the case that I've got. Its a joy to work with. Definitely going Corsair for PSU as well. They're rock bloody solid.

As for M2, I'm a little torn there due to pricing again. I've seen the performance and its frankly, wild. Just don't know that it justifies the expense. Its probably a good idea to grab a board with the option though, so thanks for that.

Do we have any solid pricing on the 1080/1070? I'm waiting for someone to do a write up on render performance as well, plus it'll be interesting to see how the Polaris cards stack up. Probably won't be better for our purposes but interesting none the less.

Thanks for the input mate!"
2065,2065,"> Is /r/altright down?

No it's going along quite nicely actually",australia,True,"Why would you waste your time in a place that ""promotes white genocide and degenerate behaviour""?

Is /r/altright down?"
2303,2303,"Egregious human rights abuses are a great way of showing you're better than them right? Not funny mate, just fucking disgusting ",australia,True,They just need to disappear. Never seen or heard of again. 
2378,2378,"You know the saying, 'TAKES ONE TO KNOW ONE""!",australia,False,You are an absolute knobhead
2465,2465,"Oh man, really? Shit. It's not something I'd wish on anyone.
",australia,False,Holy shit you called it. Apparently his sister Julia Baird (the ABC presenter) has had cancer resurface.
2733,2733,"Keep on saying it, you'll get it right eventually. ",australia,False,"Here comes the crash people. 

I hope all those baby boomers with negatively geared investment portfolios have enjoyed their run while it lasted. "
2816,2816,"By law (if not convention), the Union Jack *is* still our flag even here in 2017.

&gt;In Australia, the Union Jack was the sole official flag for use on land until Federation. After the creation of the Australian flag, the Union Jack continued to be regarded as the national flag of Australia, though gradually such usage was shared with the Australian red ensign, and later with the Australian blue ensign. The Flags Act 1953 has a clause that authorises the continued use of the Union Jack in Australia, though its usage has declined from the 1970s. 

Until pretty recently the Australian government had official reminders on its website on the correct way to fly the Union Jack.",australia,False,"Australia has another countries flag on it (and even worse it's the fucking UK). Truly, one of the most cucked of nations."
3131,3131,"And for lots of people, the social stuff is too frivolous to change their vote. Business and tax concessions literally buy the Liberals the ability to ~~violate human rights and accelerate climate change~~ protect their sponsors' interests.",australia,False,small-L liberal and Liberal is pretty close in terms of economic ideology.  The big difference is in the social policies
3142,3142,"That's a very good point you have there. I guess I was wrong on my part for some of your points. 

",australia,False,"It doesn't seem like you do, and given that I have never stated any 'fuck the rich rhetoric' it looks like you're falling for something that you've created yourself.

Actually, no.

Here's what I support. Realistic historical analysis.

Many economic theories have *some* point to them, but overall models tend to fail as they attempt to squash reality into their framework which is inherently doomed.

Going back to Locke and applying that to Keynesian economics, you can (if you want) argue that Locke's points about rent being 'dead' money related to Kenynesian theories of excess savings being detrimental to the economy, as one example.

To a certain extent, that's kind of true. But when you look at 'net' savings of an entire nation, it kind of doesn't quite work that way. When the ultra-rich hoard, that becomes a problem. However, when the middle to lower income brackets have what most Keynesians would define as excess savings, that actually becomes a beneficial aspect to the economy as they do not default on loans, fall behind on bills, or suffer the vagaries of existence that come from not having enough money.

The Laffer curve likewise is pure fantastical bullshit, and does not actually relate to real world historical examples, and is as I mentioned elsewhere, an example of a bullshit economic theory used to push certain agendas.

So, one way of determining whether someone actually understands how economics in the real world works, is to ask them something like your question.

If they respond with either, they don't get it.

If they can point out the pros and cons of both, while discussing how the theories themselves are fundamentally flawed, they may well actually understand economics as opposed to understanding economic theory, which does not actually relate, more often than not, to real world cases other than by brute force measures.

Also, yes, there's an obvious tie-in with the two and Locke. "
3392,3392,"You need to calm down buddy, maybe go have a cup of tea. That always makes me feel better. :)",australia,True,Go fuck yourself.
3631,3631,High level reasoning exposed.,australia,True,Stop immigration from shithole countries. 
3645,3645,"And now, ladies and gentlemen, watch the Nazi run and strawman because he knows race realism is bullshit feels over reals at its finest.",australia,True,"Them internet credentials. Nice. Debates over now, Asian medical scientist here to prove evolution and adaptation isn't actually a thing and all racial changes are cosmetic! You sure got me. But seriously, this is pathetic now. I'm off as I said. Enjoy your Nobel Prize."
3753,3753,"Sure, team up with the real fascists of the world against the country who has given you peace and prosperity since WWII. 

The coalition of the unicorns.",australia,False,"We could team up with the rest of the solar system and still be a few carriers short.  
Just wait for them to have their next civil war (you go Don, send the feds in to Chicago wcgw) and pick through the ashes of whatever is left."
4072,4072,It was proposed in the 1940's in the United States by the free-market economist Milton Friedman. It's hardly a Socialist idea.,australia,False,Hooray socialism
4111,4111,you're cruisin for a bruisin mate.,australia,True,"You dumb cunt.

There's no satay beef at Maccas."
4601,4601,"You're a clever one, aren't ya",australia,True,[removed]
4816,4816,They've tripled the debt in half the time,australia,False,The labor party voted down all of the abbott govt savinga measure it had to implement when it inherited the rudd debt
5059,5059,You punny little shit.,australia,True,"Correct. It should have been:  
*CONFIRMED*: *Disaster* quits front ALP bench."
5100,5100,"What he deliberately left out was that about the microendemic species is that they were recently ravaged by bushfire, which means it's mostly young regrowth there. Younger trees have lower concentrations per gram of bark AND have less bark, so cultivation of what IS an endangered species, due to the fires, WILL harm their chances of survival in the future.

That and his rampant anti-semitism and holocaust denial.",australia,True,Thanks very much. Awesome reply
5272,5272,"Trust me I have.  I made quite possibly the least loaded thread imaginable, literally a graph which showed Australia's foreign born population as a function of time against all of the other OECD countries.  Needless to say it was removed.  When a thread that is literally just a graph get removed, people end up hijacking threads like this.",australia,True,"There's a time and a place mate, this guy has accomplished something awesome. He deserves praise, his battle is intrinsic of Australian culture and we should all be proud that this gentleman calls himself Australian.

If you want to discuss the nuances of r/australia and it's stance on immigration go and make another thread. "
5284,5284,"&gt; I don't believe this for a second.

Why?

He has had well known challenges with starting a family and, by all accounts, is very focused on his young daughter.  

I prefer the less cynical perspective.  Maybe, just maybe, after twenty years and finally achieving some stability and happiness in his personal life, he has decided to focus on his family?",australia,False,"Wants more time with family. 

I don't believe this for a second."
5496,5496,"Oh wow, I forgot we got arrogant, pseudointellectual neckbeards around these parts.",australia,True,"The lack of critical thinking and memexolosiveshits is strong... Etc. I'd say you get it,  but by your posting,  you won't "
5709,5709,"I vagually recall there being mention of the changes potentially being reversed, but I'm not sure if that happened.

The changes - I believe - required 75% of MPs to support the ballot to remove the PM (or 60% to remove the opp. leader). Then the party leader could only be elected by an equally weighted ballot of both caucus and party members. 

So while a PM or Opp leader could be replaced, it significantly curtailed the ability of the party room to stage a coup.",australia,False,What were the changes? I'm just asking because this is the first I've heard of this.
5718,5718,"(consumes it all)

""Thank you infidel good bye!""",australia,False,"&gt; ""Yes, I am Christian praise Jesus, peace be upon him, praise Alaah! can I get in now?""

""No worries mate! Here, have a cheese and bacon pie, and a beer to wash it down with. Welcome to Australia!"""
5778,5778,And then the next commenter will be trashing socialised healthcare because of 'gubmint waste' or some bullshit. It blows my mind how some people in the US really can't see how shit their healthcare is. ,australia,False,"It's quite common to see around reddit the ""I can't / couldn't afford to go see a doctor."" comment from US posters."
5852,5852,Nonsense. That's a blanket statement that in no way applies to all business. ,australia,False,"The days of the week that they do the most trade. If they can't afford these higher wages then they shouldn't open or change their business plan. 

"
5877,5877,"My bad, might have used the wrong terminology there. 

However most people who pick on other communities after these types of attacks tend to do so based on the appearance of the individual  (particularly their ethnicity more than anything) rather than the religion. 

But still I get where you're coming from and I guess it can be easy to mismatch the two terms.",australia,True,I really wish people would stop calling it racism. I am anti religion not racist. 
6090,6090,"It is important to note here that while offsetting losses against other income is fair and common, there isn't another country in the world that lets you offset investment losses against wage or salary income. Australia is unique in that respect, and along with the CGT discount that's where the distortion comes from. In most other countries, you can only offset losses in a prticular income stream against income from the same stream, i.e. property losses against income from property - not across income streams.",australia,False,"Here is my ELI10. It simplifies the tax system and ignores CGT. whatevs. I fudged my maths slightly somewhere, but the point remains:

Basically, you buy a rental property with a loan and you claim the interest payments (and other expenses) as a deduction against your *income*, rather than having the interest expense quarantined to being deducted against the rent.

Hypothetical land, where numbers are made up

Say you earn $200,000 and pay 50% tax (you pay $100,000 tax per year) . You get a loan to buy a rental property for $700,000. You pay 5% interest on this loan ($35,000) and earn $10,000 in rent. You make a $25,000 loss on your rental property and get to declare this as a deduction against your income every year. 

This means that every year you're losing $25,000 on your rental property, but gaining $12,500 of that in tax savings. Total net loss of $12,500/year.

So why the fuck would you deliberately buy a property that’s losing you $12,500 per year???

Fast forward 5 years. You've lost $62,500 due to that pesky rental property.

But that rental property you bought for 700,000 is now worth $1,000,000. Time to sell! You make $300,000 in sweet sweet profit, less the $62,000 in rental losses. $237,000 for sitting on a property for a few years. Not too shabby. You never really planned to make any rental profit off that property. You only bought it for the tax deduction and for the profit on sale.

Because it works by giving you a deduction on your income, it's great for the person on $200,000 who is paying 50% tax. It aint so great for someone on $50,000 who pays say 20% tax. The $25,000 tax deduction per year should only save them say $5,000 per year, meaning a net loss of $20,000/yr. over 5 years they lose $100,000 in rent, meaning they only net $200,000 from the sale. Not bad, but it doesn't benefit them nearly as much

**Why bad?**

1) Loss of tax revenue! The stuff that builds roads, hospitals, schools, NBNs. these people are claiming a tax deduction on their ""rental property"" when really they're buying the property with the *intention* of making a loss. We let that fucking rich guy claim $62,500 in deductions. That could've paid for a nurse for a year.

Generally a smarter way would be to quarantine their rental property as being its own ""entity"" for tax purposes. What does your rental property have to do with your job as a lawyer? Nothing. So why do you get to declare it as a loss against your lawyer income?

2) It makes it too damn appealing to buy a rental property because the ""loophole"" is just too good. It's basically free money. Lots of people buying houses that they don't need (or wouldn't want if it wasn't for the sweet sweet tax deduction), drives up prices due to supply and demand. There's a fixed supply of houses but demand keeps rising as people want to buy tax deduction houses. 

3) it also means that there are a lot of people with mortgages on overpriced houses that they're not even making a profit on. Eventually the housing bubble will burst and we'll have loans worth more than the house is worth. 

The housing bubble pops and we have the lady on $50,000 income with a rental property that's costing her $20,000 per year and is now only worth $500,000. 

In my lawyer example, *without negative gearing* he would have lost $25,00/yr for 5 years (total loss 125,000) before selling for $300,000. He still gains 175,000, but that's far less than the $237,000 he got with the benefit of negative gearing. That extra cash comes from our tax dollars. We're paying for his investment property"
6182,6182,"> The Commonwealth Government currently provides eligible cardholders with compensation towards energy costs, including the ***Energy Supplement***.

There's no such thing as the ""clean energy rebate"". Newstart recipients get an Energy Supplement paid in small increments.",australia,True,"This is the state based rebate, not the clean energy rebate which is given automatically to benefit recipients."
6212,6212,"Jesus, dude.",australia,True,Fuck off and die.
