Unnamed: 0,id,body,subreddit,removed,context
6321,6321,"You won't convince the rest of the marxist cucks in this thread of that. They're to busy fighting with their conflicted emotions arising from failed validation. They think all this virtue signalling will make them better people... Somehow change their genes and make a better world.

What they don't realise it's that fear of your true nature only creates the self loathing prisoner.

The problem isn't immigration... The problem is division, lack of integration, no unification.

Strength through Unity, not diversity.",australia,True,"You think that hard-line nationalists hate their own culture? They are literally fighting to preserve Australian culture, whether you agree with them or not.
"
6379,6379,Where the fuck did I say that? Fucking retard,australia,True,But you mob think you know Australia like we do? 
6519,6519,"It didn't read like a joke, though, that's the problem. It read as an assumption.

Which brings up another issue- the stereotype of the humourless vegan. Many of us laugh. A lot. We're not humourless. But when you're the recipient of a constant onslaught of flippant jokes about something which is deeply meaningful to you, it gets really old.

People who say ""mmm, bacon"" or ""don't worry, they'll tell you"" think they're being clever or original. They haven't seen the multitudes who've already said it. And they'll accuse us of ""being able to talk about nothing but veganism"" even when they brought it up and it's actually relevant to the conversation.

Try to remember that we're human beings. It hurts constantly seeing something we find abhorrent being laughed about. And no, I don't think vegans are oppressed. But I do think animals are, and even if others don't understand that it would be nice if they could try and have a little empathy.",australia,False,"It was a joke. Much like this one. ""How do you know if someone's a  vegan? Just wait,they'll tell you"""
